{
  "episode_id": "EP001",
  "provider": "seedance",
  "model": "seedance-2.0",
  "default_audio_policy": "ambience_only",
  "clips": [
    {
      "clip_id": "V01",
      "filename": "video-clips/V01-dry-well-hook.mp4",
      "shot_ids": ["S01"],
      "mode": "image_to_video",
      "timeline_duration_sec": 5,
      "requested_duration_sec": 5,
      "reference_assets": ["A01"],
      "reference_videos": [],
      "reference_audio": [],
      "initial_state": "干裂井底居中，阿远提着空桶站在前景，村民围在井边低头查看。",
      "primary_action": "阿远慢慢提起空桶，周围村民同时向井底探身。",
      "camera_motion": "从井口缓慢拉远，揭示围观人群。",
      "prompt": "参考 A01 固定阿远、村民、石井和阴沉清晨。镜头开始于干裂井底，阿远缓慢提起空桶，周围村民低头探看。相机从井口克制地缓慢拉远，只完成这一个动作。保持手绘寓言绘本质感、角色服装、井台结构和 9:16 构图。只生成木桶空响与轻微环境风声，不要对白。",
      "audio_mode": "ambience_only",
      "continuity_constraints": ["作为结果前置镜头", "阿远服装必须与角色圣经一致", "井台结构供 S10 复用"],
      "negative_constraints": ["不说话", "不生成字幕", "不增加人物", "不改变脸和服装", "不做快速旋转运镜"],
      "edit_instruction": "直接使用 5 秒；结尾保留约 0.3 秒空响余韵。",
      "review_checks": ["阿远身份稳定", "空桶和手部无变形", "拉远平稳", "存在可用入点和出点"],
      "fallback": "使用 A01 静帧从井口向外做 5% 拉远并叠加空桶音效。",
      "status": "planned"
    },
    {
      "clip_id": "V02",
      "filename": "video-clips/V02-normal-well-wide.mp4",
      "shot_ids": ["S02"],
      "mode": "image_to_video",
      "timeline_duration_sec": 7,
      "requested_duration_sec": 7,
      "reference_assets": ["A02"],
      "reference_videos": [],
      "reference_audio": [],
      "initial_state": "暖晨光中的雾谷村，短队伍在公共井边有序取水。",
      "primary_action": "两名村民各提一桶水离开，阿远向井口前进一步。",
      "camera_motion": "极慢推向井口。",
      "prompt": "参考 A02 固定雾谷公共井、阿远和暖晨光。两名村民各自提一桶水自然离开，阿远向井口前进一步。相机只做极慢推近，动作平静有序。保持 9:16 手绘寓言绘本风格。可生成轻水声和鸟鸣，不要对白。",
      "audio_mode": "ambience_only",
      "continuity_constraints": ["这是几天前的正常状态", "水位充足", "队伍很短"],
      "negative_constraints": ["不增加大桶", "不制造拥挤", "不说话", "不生成文字"],
      "edit_instruction": "完整使用；开头与 V01 用冷暖反差硬切。",
      "review_checks": ["井台与 A02 一致", "每人只有一桶", "动作自然", "推镜平稳"],
      "fallback": "A02 静帧轻推并加入水声。",
      "status": "planned"
    },
    {
      "clip_id": "V03",
      "filename": "video-clips/V03-normal-routine.mp4",
      "shot_ids": ["S03"],
      "mode": "multimodal_reference",
      "timeline_duration_sec": 10,
      "requested_duration_sec": 8,
      "reference_assets": ["A02"],
      "reference_videos": ["video-clips/V02-normal-well-wide.mp4"],
      "reference_audio": [],
      "initial_state": "同一井台中景，岚婆婆扶着辘轳，阿远等待一桶水。",
      "primary_action": "岚婆婆平稳转动辘轳，阿远接过一桶后离开。",
      "camera_motion": "从岚婆婆横移到阿远，再停在稳定水面。",
      "prompt": "延续 V02 的井台、光线和角色身份。岚婆婆平稳转动辘轳，阿远只接过一桶水并离开。相机从岚婆婆缓慢横移到阿远，最后停在可见的稳定水面。动作克制、日常。只生成辘轳和水声，不要对白。",
      "audio_mode": "ambience_only",
      "continuity_constraints": ["与 V02 同一天同一光线", "阿远只取一桶", "水面充足稳定"],
      "negative_constraints": ["不出现第二只桶", "不说话", "不改变井台", "不出现快速动作"],
      "edit_instruction": "使用 8 秒主体，结尾水面停帧 2 秒并做极轻微推近，补足 10 秒。",
      "review_checks": ["岚婆婆身份稳定", "辘轳和手部自然", "阿远只拿一桶", "与 V02 连续"],
      "fallback": "使用 A02 裁切为两个静帧镜头，在剪映内横移和停帧。",
      "status": "planned"
    },
    {
      "clip_id": "V04",
      "filename": "video-clips/V04-extra-bucket.mp4",
      "shot_ids": ["S04"],
      "mode": "image_to_video",
      "timeline_duration_sec": 7,
      "requested_duration_sec": 7,
      "reference_assets": ["A03"],
      "reference_videos": [],
      "reference_audio": [],
      "initial_state": "邻居提着两只桶经过，阿远手中只有一桶。",
      "primary_action": "阿远的视线从邻居的第二只桶移到自己的单桶。",
      "camera_motion": "先停在第二只桶，再轻推到阿远表情。",
      "prompt": "参考 A03 固定人物和井边位置。邻居提着两只桶缓慢离开，阿远不动，只把视线从第二只桶移到自己手中的单桶。镜头先停在第二只桶，再克制推向阿远的迟疑表情。不要对白和夸张表演。",
      "audio_mode": "ambience_only",
      "continuity_constraints": ["光线比正常状态略冷", "阿远仍只有一桶", "邻居不是反派表情"],
      "negative_constraints": ["不让阿远说话", "不改变桶数量", "不做奸笑", "不生成文字"],
      "edit_instruction": "保留桶碰石板的环境声，旁白覆盖其余声音。",
      "review_checks": ["视线方向清晰", "桶数量正确", "表情不是贪婪", "镜头意图一眼可懂"],
      "fallback": "A03 静帧从桶裁切推到阿远面部。",
      "status": "planned"
    },
    {
      "clip_id": "V05",
      "filename": "video-clips/V05-decision.mp4",
      "shot_ids": ["S05"],
      "mode": "image_to_video",
      "timeline_duration_sec": 7,
      "requested_duration_sec": 7,
      "reference_assets": ["A04"],
      "reference_videos": [],
      "reference_audio": [],
      "initial_state": "阿远握着桶柄，第二只空桶在身旁，他看向家的方向。",
      "primary_action": "阿远短暂停顿后，把第二只桶拖近井边。",
      "camera_motion": "轻微推近，不改变机位方向。",
      "prompt": "参考 A04 固定阿远外形、服装和两只桶。阿远因担心家中老人而犹豫，短暂停顿后把第二只空桶拖近井边。相机轻微推近，只表现这个决定。表情克制，不要贪婪或奸诈。只保留桶柄摩擦和环境声。",
      "audio_mode": "ambience_only",
      "continuity_constraints": ["阿远服装延续 V04", "第二只桶是后续固定符号", "情绪是担忧"],
      "negative_constraints": ["不说话", "不出现老人正脸", "不增加第三只桶", "不改变服装"],
      "edit_instruction": "在拖桶动作完成时切到 V06。",
      "review_checks": ["情绪准确", "桶的拖动自然", "手部无异常", "出点清楚"],
      "fallback": "A04 静帧轻推，叠加桶柄摩擦声。",
      "status": "planned"
    },
    {
      "clip_id": "V06",
      "filename": "video-clips/V06-crowd-arrives.mp4",
      "shot_ids": ["S06"],
      "mode": "multimodal_reference",
      "timeline_duration_sec": 8,
      "requested_duration_sec": 8,
      "reference_assets": ["A05"],
      "reference_videos": ["video-clips/V05-decision.mp4"],
      "reference_audio": [],
      "initial_state": "第三天薄雾中，井边队伍变长，村民脚边有大小不同的桶。",
      "primary_action": "队伍缓慢向前移动，岚婆婆低头查看井内。",
      "camera_motion": "从队尾横移到井口。",
      "prompt": "参考 A05 和 V05 延续阿远、岚婆婆、井台及第二只桶。第三天薄雾中，队伍缓慢前移，岚婆婆低头查看井内。相机从队尾横移到井口。群像只做统一的小幅移动，不让每个人独立表演。生成脚步、桶碰撞和轻微低语环境声，不要清晰对白。",
      "audio_mode": "keep_if_usable",
      "continuity_constraints": ["薄雾比前一日更重", "阿远保持两只桶", "井台空间不变"],
      "negative_constraints": ["不复制相同人物", "不增加夸张动作", "不生成清晰台词", "不改变角色服装"],
      "edit_instruction": "环境低语可用则降低音量保留，不可用则静音并由剪映补环境声。",
      "review_checks": ["群像无重复畸形", "阿远可识别", "横移稳定", "桶和手部可用"],
      "fallback": "A05 静帧横移，配合脚步和桶碰撞音效。",
      "status": "planned"
    },
    {
      "clip_id": "V07",
      "filename": "video-clips/V07-crowd-mimics.mp4",
      "shot_ids": ["S07"],
      "mode": "image_to_video",
      "timeline_duration_sec": 8,
      "requested_duration_sec": 8,
      "reference_assets": ["A05"],
      "reference_videos": [],
      "reference_audio": [],
      "initial_state": "几个村民护着自己的桶，阿远处在人群中央。",
      "primary_action": "一名村民把桶向前挪，周围两人随即模仿。",
      "camera_motion": "轻微横移，保持井口方向稳定。",
      "prompt": "参考 A05 固定群像和阿远。一名村民把自己的桶向前挪半步，周围两名村民看到后随即做同样动作，阿远处在人群中央观察。只表现模仿扩散这一个动作。相机轻微横移，保持绘本稳定感。不要对白。",
      "audio_mode": "ambience_only",
      "continuity_constraints": ["延续 V06 的薄雾和拥挤程度", "阿远有两只桶", "人物没有反派脸"],
      "negative_constraints": ["不让所有人同时大动作", "不说话", "不增加人物", "不做手持抖动"],
      "edit_instruction": "在第二个人完成模仿时切到井内 V08。",
      "review_checks": ["模仿关系清晰", "人物无重复", "动作幅度克制", "切出点明确"],
      "fallback": "A05 进行两次局部裁切，用桶移动音效表现模仿。",
      "status": "planned"
    },
    {
      "clip_id": "V08",
      "filename": "video-clips/V08-water-falls.mp4",
      "shot_ids": ["S08"],
      "mode": "image_to_video",
      "timeline_duration_sec": 8,
      "requested_duration_sec": 8,
      "reference_assets": ["A06"],
      "reference_videos": [],
      "reference_audio": [],
      "initial_state": "从井口俯视，低水位和干燥水痕清晰可见。",
      "primary_action": "两只木桶先后落到水面并提起，水面持续波动。",
      "camera_motion": "极慢向下推近水面。",
      "prompt": "参考 A06 固定石井内部和低水位。从井口俯视，两只木桶先后落到水面并提起，水面被连续搅动，干燥水痕保持清晰。相机极慢向下推近。不要出现人物脸和文字。生成逐渐变空的水声与辘轳声。",
      "audio_mode": "ambience_only",
      "continuity_constraints": ["水位比 V03 明显低", "仍有少量水，不是完全干涸", "石井材质一致"],
      "negative_constraints": ["不增加多只交叉木桶", "不改变井的形状", "不生成文字", "不出现超现实水流"],
      "edit_instruction": "完整使用；结尾水声逐渐变空，为 V09 铺垫。",
      "review_checks": ["桶运动自然", "水位关系正确", "井壁无形变", "音效可用"],
      "fallback": "A06 静帧下推，剪映叠加桶影和水声。",
      "status": "planned"
    },
    {
      "clip_id": "V09",
      "filename": "video-clips/V09-before-empty.mp4",
      "shot_ids": ["S09"],
      "mode": "image_to_video",
      "timeline_duration_sec": 8,
      "requested_duration_sec": 8,
      "reference_assets": ["A07"],
      "reference_videos": [],
      "reference_audio": [],
      "initial_state": "黎明前，长队绕过井台，每个人身旁都有多个桶。",
      "primary_action": "队伍极慢前移，阿远先看前方的桶，再回看身后的桶。",
      "camera_motion": "极慢推近井口。",
      "prompt": "参考 A07 固定黎明前的长队、阿远、岚婆婆和井台。队伍极慢前移，阿远先看前方的大桶，再回看身后同样的桶。相机极慢推向井口，情绪接近临界点。环境声音逐渐收窄，不要对白。",
      "audio_mode": "ambience_only",
      "continuity_constraints": ["天未亮", "队伍和桶数量明显多于 V06", "井台空间一致"],
      "negative_constraints": ["不快速移动", "不说话", "不增加灯光特效", "不改变阿远服装"],
      "edit_instruction": "结尾降低音乐，只保留辘轳声，切入 V10。",
      "review_checks": ["阿远身份稳定", "长队空间合理", "慢推平稳", "情绪达到临界但不恐怖"],
      "fallback": "A07 静帧慢推，逐步削弱背景音乐。",
      "status": "planned"
    },
    {
      "clip_id": "V10",
      "filename": "video-clips/V01-dry-well-hook.mp4",
      "shot_ids": ["S10"],
      "mode": "reuse_clip",
      "timeline_duration_sec": 6,
      "requested_duration_sec": 0,
      "reference_assets": ["A01"],
      "reference_videos": ["video-clips/V01-dry-well-hook.mp4"],
      "reference_audio": [],
      "initial_state": "复用 V01 的干井状态。",
      "primary_action": "无新生成动作。",
      "camera_motion": "剪映裁切到空桶与阿远表情。",
      "prompt": "不调用 Seedance。",
      "audio_mode": "not_applicable",
      "continuity_constraints": ["必须与开头干井完全一致"],
      "negative_constraints": ["不重新生成"],
      "edit_instruction": "复用 V01，先裁切空桶落底，再切阿远表情；加入清晰空响后静音 0.8 秒。",
      "review_checks": ["干井状态一致", "裁切后分辨率可用", "停顿足够"],
      "fallback": "直接使用 A01 两次裁切。",
      "status": "not_applicable"
    },
    {
      "clip_id": "V11",
      "filename": "edit/title-card-reveal",
      "shot_ids": ["S11"],
      "mode": "edit_only",
      "timeline_duration_sec": 10,
      "requested_duration_sec": 0,
      "reference_assets": ["A01"],
      "reference_videos": ["video-clips/V01-dry-well-hook.mp4"],
      "reference_audio": [],
      "initial_state": "干井背景暗化。",
      "primary_action": "剪映中分两拍出现概念名称。",
      "camera_motion": "背景极慢推近。",
      "prompt": "不调用 Seedance，不生成图内文字。",
      "audio_mode": "not_applicable",
      "continuity_constraints": ["概念名称在此首次出现"],